{
    "$schema": "https://json-schema.org/draft/2020-12/schema",
    "$id": "https://baobabcms.com/schemas/module.schema.json",
    "title": "Baobab CMS module manifest",
    "description": "Schema for module.json — the manifest of every Baobab package (module, theme, or content-type). Spec reference: docs/specs/01-modules.md §2.2, docs/specs/03-themes.md §2.1.",
    "type": "object",
    "required": [
        "name",
        "title",
        "version",
        "type",
        "provider"
    ],
    "additionalProperties": false,
    "properties": {
        "name": {
            "type": "string",
            "description": "Composer-style package name (vendor/slug).",
            "pattern": "^[a-z0-9]([_.-]?[a-z0-9]+)*\\/[a-z0-9](([_.]|-{1,2})?[a-z0-9]+)*$"
        },
        "title": {
            "type": "string",
            "minLength": 1,
            "maxLength": 100
        },
        "description": {
            "type": "string",
            "maxLength": 500
        },
        "version": {
            "type": "string",
            "description": "Semantic version (MAJOR.MINOR.PATCH).",
            "pattern": "^(0|[1-9]\\d*)\\.(0|[1-9]\\d*)\\.(0|[1-9]\\d*)(-[0-9A-Za-z.-]+)?$"
        },
        "type": {
            "type": "string",
            "enum": [
                "module",
                "theme",
                "content-type"
            ]
        },
        "icon": {
            "type": "string",
            "description": "Icon key from the Baobab icon set."
        },
        "authors": {
            "type": "array",
            "items": {
                "type": "object",
                "required": [
                    "name"
                ],
                "additionalProperties": false,
                "properties": {
                    "name": {
                        "type": "string"
                    },
                    "email": {
                        "type": "string",
                        "format": "email"
                    },
                    "url": {
                        "type": "string",
                        "format": "uri"
                    }
                }
            }
        },
        "provider": {
            "type": "string",
            "description": "Fully qualified class name of the module service provider.",
            "pattern": "^([A-Z][A-Za-z0-9_]*\\\\)+[A-Z][A-Za-z0-9_]*$"
        },
        "requires": {
            "type": "object",
            "additionalProperties": false,
            "properties": {
                "cms": {
                    "type": "string",
                    "description": "Baobab core version constraint (Composer syntax)."
                },
                "php": {
                    "type": "string",
                    "description": "PHP version constraint (Composer syntax)."
                },
                "modules": {
                    "type": "object",
                    "description": "Module dependencies: package name → version constraint.",
                    "propertyNames": {
                        "pattern": "^[a-z0-9]([_.-]?[a-z0-9]+)*\\/[a-z0-9](([_.]|-{1,2})?[a-z0-9]+)*$"
                    },
                    "additionalProperties": {
                        "type": "string"
                    }
                }
            }
        },
        "permissions": {
            "type": "array",
            "description": "Permissions declared by this module, registered on activation (spec 05 §3).",
            "items": {
                "type": "object",
                "required": [
                    "key",
                    "label"
                ],
                "additionalProperties": false,
                "properties": {
                    "key": {
                        "type": "string",
                        "description": "domain.object.action[_scope] — the 'baobab.' prefix is reserved for core.",
                        "pattern": "^[a-z][a-z0-9_]*(\\.[a-z][a-z0-9_]*){1,3}$"
                    },
                    "label": {
                        "type": "string"
                    },
                    "default_roles": {
                        "type": "array",
                        "items": {
                            "type": "string"
                        }
                    }
                }
            }
        },
        "menus": {
            "type": "object",
            "additionalProperties": false,
            "properties": {
                "admin": {
                    "type": "array",
                    "items": {
                        "$ref": "#/$defs/adminMenuItem"
                    }
                }
            }
        },
        "widgets": {
            "type": "array",
            "items": {
                "type": "object",
                "required": [
                    "key",
                    "class"
                ],
                "additionalProperties": false,
                "properties": {
                    "key": {
                        "type": "string",
                        "pattern": "^[a-z][a-z0-9_]*(\\.[a-z][a-z0-9_-]*)+$"
                    },
                    "class": {
                        "type": "string",
                        "pattern": "^([A-Z][A-Za-z0-9_]*\\\\)+[A-Z][A-Za-z0-9_]*$"
                    }
                }
            }
        },
        "hooks": {
            "type": "object",
            "additionalProperties": false,
            "properties": {
                "emits": {
                    "type": "array",
                    "description": "Hook names this module fires (documentation + registry).",
                    "items": {
                        "$ref": "#/$defs/hookName"
                    }
                },
                "listens": {
                    "type": "object",
                    "description": "Declarative wiring: hook name → listener class.",
                    "propertyNames": {
                        "pattern": "^[a-z][a-z0-9_]*(\\.[a-z][a-z0-9_]*)+$"
                    },
                    "additionalProperties": {
                        "type": "string",
                        "pattern": "^([A-Z][A-Za-z0-9_]*\\\\)+[A-Z][A-Za-z0-9_]*$"
                    }
                }
            }
        },
        "media_presets": {
            "type": "object",
            "description": "Image conversion presets declared by this module or theme (spec 06 §4.1).",
            "propertyNames": {
                "pattern": "^[a-z][a-z0-9_-]*$"
            },
            "additionalProperties": {
                "type": "object",
                "additionalProperties": false,
                "properties": {
                    "width": {
                        "type": "integer",
                        "minimum": 1
                    },
                    "height": {
                        "type": "integer",
                        "minimum": 1
                    },
                    "fit": {
                        "type": "string",
                        "enum": [
                            "contain",
                            "crop",
                            "fill"
                        ]
                    },
                    "quality": {
                        "type": "integer",
                        "minimum": 1,
                        "maximum": 100
                    }
                },
                "anyOf": [
                    {
                        "required": [
                            "width"
                        ]
                    },
                    {
                        "required": [
                            "height"
                        ]
                    }
                ]
            }
        },
        "settings_page": {
            "type": "string",
            "description": "Route name of the module settings screen."
        },
        "schedule": {
            "type": "array",
            "description": "Scheduled tasks declared by this module (spec 12 §2), registered by Baobab\\Scheduler\\SchedulerRegistrar while the module is active. Every run is recorded in scheduled_task_runs.",
            "items": {
                "type": "object",
                "required": [
                    "key",
                    "command",
                    "cron"
                ],
                "additionalProperties": false,
                "properties": {
                    "key": {
                        "type": "string",
                        "description": "Unique task identifier, stored as scheduled_task_runs.task_key.",
                        "pattern": "^[a-z][a-z0-9_]*(\\.[a-z][a-z0-9_-]*)+$"
                    },
                    "command": {
                        "type": "string",
                        "description": "Artisan command signature or FQCN to run."
                    },
                    "cron": {
                        "type": "string",
                        "description": "Cron expression (5 fields)."
                    }
                }
            }
        },
        "mails": {
            "type": "array",
            "description": "Templates d'e-mails déclarés par ce module (spec 13 §3.1), résolus par Baobab\\Mail\\Mailer. Un e-mail applicatif n'existe pas sans template déclaré ici.",
            "items": {
                "type": "object",
                "required": [
                    "key",
                    "variables",
                    "defaults"
                ],
                "additionalProperties": false,
                "properties": {
                    "key": {
                        "type": "string",
                        "description": "Identifiant stable, préfixé par le slug du module ('core.' réservé au noyau).",
                        "pattern": "^[a-z][a-z0-9_]*(\\.[a-z][a-z0-9_-]*)+$"
                    },
                    "description": {
                        "type": "string"
                    },
                    "variables": {
                        "type": "object",
                        "description": "Contrat des placeholders disponibles pour ce template : nom → libellé, ou {label, required}.",
                        "propertyNames": {
                            "pattern": "^[a-z][a-zA-Z0-9_]*(\\.[a-z][a-zA-Z0-9_]*)*$"
                        },
                        "additionalProperties": {
                            "oneOf": [
                                {
                                    "type": "string"
                                },
                                {
                                    "type": "object",
                                    "required": [
                                        "label"
                                    ],
                                    "additionalProperties": false,
                                    "properties": {
                                        "label": {
                                            "type": "string"
                                        },
                                        "required": {
                                            "type": "boolean"
                                        }
                                    }
                                }
                            ]
                        }
                    },
                    "defaults": {
                        "type": "string",
                        "description": "Chemin vers un JSON {subject, body} relatif à la racine du module."
                    }
                }
            }
        },
        "notifications": {
            "type": "array",
            "description": "Notifications déclarées par ce module (spec 11 §6), résolues par Baobab\\Notify\\Notifier.",
            "items": {
                "type": "object",
                "required": [
                    "key",
                    "channels"
                ],
                "additionalProperties": false,
                "properties": {
                    "key": {
                        "type": "string",
                        "description": "Identifiant stable, préfixé par le slug du module ('core.' réservé au noyau).",
                        "pattern": "^[a-z][a-z0-9_]*(\\.[a-z][a-z0-9_-]*)+$"
                    },
                    "description": {
                        "type": "string"
                    },
                    "channels": {
                        "type": "array",
                        "description": "Canaux par défaut.",
                        "minItems": 1,
                        "items": {
                            "type": "string",
                            "enum": [
                                "database",
                                "mail"
                            ]
                        }
                    },
                    "mail_template": {
                        "type": "string",
                        "description": "Clé du template d'e-mail (spec 13 §3.1) — requis si 'mail' figure dans channels."
                    },
                    "configurable": {
                        "type": "boolean",
                        "description": "false verrouille les préférences (notifications de sécurité non désactivables, spec 11 §6). Défaut true.",
                        "default": true
                    }
                },
                "allOf": [
                    {
                        "if": {
                            "properties": {
                                "channels": {
                                    "contains": {
                                        "const": "mail"
                                    }
                                }
                            }
                        },
                        "then": {
                            "required": [
                                "mail_template"
                            ]
                        }
                    }
                ]
            }
        },
        "autoload": {
            "type": "object",
            "description": "PSR-4 mappings for classes shipped by this module, registered dynamically by ModuleAutoloader when the module is active (spec 01 §7.1 decision 1). Same syntax as composer.json's autoload.psr-4.",
            "additionalProperties": false,
            "properties": {
                "psr-4": {
                    "type": "object",
                    "description": "Namespace prefix (with trailing backslash) → path relative to the module root.",
                    "propertyNames": {
                        "pattern": "^([A-Z][A-Za-z0-9_]*\\\\)+$"
                    },
                    "additionalProperties": {
                        "type": "string"
                    }
                }
            }
        },
        "theme": {
            "type": "object",
            "description": "Theme-specific section, required when type = theme (spec 03 §2.1).",
            "additionalProperties": false,
            "properties": {
                "parent": {
                    "type": [
                        "string",
                        "null"
                    ],
                    "pattern": "^[a-z0-9]([_.-]?[a-z0-9]+)*\\/[a-z0-9](([_.]|-{1,2})?[a-z0-9]+)*$"
                },
                "screenshot": {
                    "type": "string"
                },
                "menus": {
                    "type": "object",
                    "description": "Menu locations: key → human label.",
                    "propertyNames": {
                        "pattern": "^[a-z][a-z0-9_-]*$"
                    },
                    "additionalProperties": {
                        "type": "string"
                    }
                },
                "widget_zones": {
                    "type": "object",
                    "description": "Widget zones: key → human label.",
                    "propertyNames": {
                        "pattern": "^[a-z][a-z0-9_-]*$"
                    },
                    "additionalProperties": {
                        "type": "string"
                    }
                },
                "supports": {
                    "type": "array",
                    "items": {
                        "type": "string"
                    }
                },
                "settings_schema": {
                    "type": "string"
                }
            }
        }
    },
    "allOf": [
        {
            "if": {
                "properties": {
                    "type": {
                        "const": "theme"
                    }
                }
            },
            "then": {
                "required": [
                    "theme"
                ]
            }
        }
    ],
    "$defs": {
        "hookName": {
            "type": "string",
            "pattern": "^[a-z][a-z0-9_]*(\\.[a-z][a-z0-9_]*)+$"
        },
        "adminMenuItem": {
            "type": "object",
            "required": [
                "label"
            ],
            "additionalProperties": false,
            "properties": {
                "label": {
                    "type": "string"
                },
                "icon": {
                    "type": "string"
                },
                "route": {
                    "type": "string"
                },
                "route_params": {
                    "type": "object",
                    "description": "Named parameters passed to route() when resolving this item's URL (spec 04 §3.3).",
                    "additionalProperties": {
                        "type": "string"
                    }
                },
                "permission": {
                    "type": "string"
                },
                "order": {
                    "type": "integer"
                },
                "children": {
                    "type": "array",
                    "items": {
                        "$ref": "#/$defs/adminMenuItem"
                    }
                }
            }
        }
    }
}