{
  "name": "acme/theme-assets",
  "title": "Acme Theme Assets",
  "description": "Fixture thème dont les templates appellent <x-baobab::vite> et dont le public/build porte un manifeste Vite propre — sert à prouver quel thème fournit la feuille de style (actif ou prévisualisé). Vit à part d'acme/theme pour ne pas troubler les tests de cascade de vues, qui asservissent la sortie exacte de leurs templates.",
  "version": "1.0.0",
  "type": "theme",
  "provider": "Acme\\ThemeAssets\\Providers\\ThemeAssetsServiceProvider",
  "theme": {
    "parent": null,
    "menus": {},
    "widget_zones": {}
  }
}
